{
  "schema_version": 1,
  "metadata": {
    "name": "Project 0"
  },
  "signals": [
    {
      "name": "4channel#1",
      "source": {
        "kind": "filesystem",
        "path": "/home/owd/Documents/echomap/cmake-build-debug-native/../audio/4channel.wav",
        "channel": 1
      }
    },
    {
      "name": "4channel#2",
      "source": {
        "kind": "filesystem",
        "path": "/home/owd/Documents/echomap/cmake-build-debug-native/../audio/4channel.wav",
        "channel": 2
      }
    },
    {
      "name": "4channel#3",
      "source": {
        "kind": "filesystem",
        "path": "/home/owd/Documents/echomap/cmake-build-debug-native/../audio/4channel.wav",
        "channel": 3
      }
    },
    {
      "name": "4channel#4",
      "source": {
        "kind": "filesystem",
        "path": "/home/owd/Documents/echomap/cmake-build-debug-native/../audio/4channel.wav",
        "channel": 4
      }
    },
    {
      "name": "TestEmbeddedUniform",
      "source": {
        "kind": "embeddedUniform",
        "timing": {
          "time_offset": 0,
          "sample_rate": 10,
          "sample_count": 16
        },
        "samples": [
          0.0,
          0.08,
          0.18,
          0.35,
          0.62,
          0.9,
          1.0,
          0.82,
          0.48,
          0.12,
          -0.18,
          -0.36,
          -0.28,
          -0.12,
          -0.04,
          0.0
        ]
      }
    },
    {
      "name": "TestEmbeddedVariable",
      "source": {
        "kind": "embeddedVariable",
        "timing": {
          "time_offset": 0,
          "sample_rate": 48000,
          "sample_count": 16
        },
        "samples": [
          {
            "time": 0.0,
            "amplitude": 0.0
          },
          {
            "time": 0.1,
            "amplitude": 0.08
          },
          {
            "time": 0.2,
            "amplitude": 0.18
          },
          {
            "time": 0.3,
            "amplitude": 0.35
          },
          {
            "time": 0.4,
            "amplitude": 0.62
          },
          {
            "time": 0.5,
            "amplitude": 0.9
          },
          {
            "time": 0.6,
            "amplitude": 1.0
          },
          {
            "time": 0.7,
            "amplitude": 0.82
          },
          {
            "time": 0.8,
            "amplitude": 0.48
          },
          {
            "time": 0.9,
            "amplitude": 0.12
          },
          {
            "time": 1.0,
            "amplitude": -0.18
          },
          {
            "time": 1.1,
            "amplitude": -0.36
          },
          {
            "time": 1.2,
            "amplitude": -0.28
          },
          {
            "time": 1.3,
            "amplitude": -0.12
          },
          {
            "time": 1.4,
            "amplitude": -0.04
          },
          {
            "time": 1.5,
            "amplitude": 0.0
          }
        ]
      }
    }
  ],
  "sensors": [
    {
      "colour": {
        "r": 1.0,
        "g": 0.0,
        "b": 0.0,
        "a": 1.0
      },
      "name": "Sensor 0",
      "position": {
        "x": 0.0,
        "y": 0.0,
        "z": 0.0
      }
    },
    {
      "colour": {
        "r": 1.0,
        "g": 0.0,
        "b": 0.0,
        "a": 1.0
      },
      "name": "Sensor 1",
      "position": {
        "x": 0.0,
        "y": 0.0,
        "z": 0.0
      }
    },
    {
      "colour": {
        "r": 1.0,
        "g": 0.0,
        "b": 0.0,
        "a": 1.0
      },
      "name": "Sensor 2",
      "position": {
        "x": 0.0,
        "y": 0.0,
        "z": 0.0
      }
    },
    {
      "colour": {
        "r": 1.0,
        "g": 0.0,
        "b": 0.0,
        "a": 1.0
      },
      "name": "Sensor 3",
      "position": {
        "x": 0.0,
        "y": 0.0,
        "z": 0.0
      }
    }
  ],
  "mappings": [
    {
      "signal": "4channel#4",
      "sensor": "Sensor 0"
    },
    {
      "signal": "4channel#3",
      "sensor": "Sensor 1"
    },
    {
      "signal": "4channel#2",
      "sensor": "Sensor 2"
    },
    {
      "signal": "4channel#1",
      "sensor": "Sensor 3"
    }
  ]
}
